<!-- What courses did person [A] attend? (between years [Y] and [Z]?) -->
<query 	xmlns:xsi="http://www.w3.org/2001/XMLSchema-instance" 
		xmlns="http://digitalhps.org/lerna-query-model" 
		xsi:schemaLocation="http://digitalhps.org/lerna-query-model query-schema.xsd">
    <databaseList>
		<database>1</database>
	</databaseList>
    <dataset id = "mblcourses" />
    <node return="true">
        <and>
            <property name="type" value="Course" />              
            <relationship return="true" type="attended">
                <property name="year" type="range" start="1800" end="1920" />
                    <source>
                        <node>
	    		    		<property name="lastname" value="Setchell" /> 
                        </node>
                    </source>
            </relationship>
        </and>
    </node>      
</query>