<!--What are the Locations of Person who attended Course[C] in year[1920] ?-->
<query xmlns:xsi="http://www.w3.org/2001/XMLSchema-instance"
	xmlns="http://digitalhps.org/lerna-query-model" xsi:schemaLocation="http://digitalhps.org/lerna-query-model query-schema.xsd">
	<databaseList>
		<database>1</database>
	</databaseList>
	<dataset id="mblcourses" />
	<node return="true">
		<and>
			<property name="type" value="Location" />
			<relationship return="true" type="hasLocation">
				<source>
					<node return="true">
						<and>
							<property name="type" value="Person" />
							<relationship return="false" type="attended">
								<property name="year" value="1920"/>
								<target>
									<node return="true">
										<property name="type" value="Course" />
										<property name="name" value="Botany" />
									</node>
								</target>
							</relationship>
						</and>
					</node>
				</source>
			</relationship>
		</and>
	</node>
</query>