<!--Who was affiliated with institution [I]? (between years [Y] and [Z]?)-->
<query 	xmlns:xsi="http://www.w3.org/2001/XMLSchema-instance" 
		xmlns="http://digitalhps.org/lerna-query-model" 
		xsi:schemaLocation="http://digitalhps.org/lerna-query-model query-schema.xsd">
    <databaseList>
		<database>1</database>
	</databaseList>
    <dataset id = "mblcourses" />
    <node return="true">
        <and>
            <property name="type" value="Person" />   
            <relationship return="true" type="hasAffiliation">
                <property name="year" type="range" start="1900" end="1920" />
                    <target>
                        <node>
                            <property name="type" value="Institution" />
                            <property name="name" value="Harvard" />
                        </node>
                    </target>
            </relationship>
        </and>
    </node>      
</query>