<!--What courses did people from institution [I] attend? -->
<query xmlns:xsi="http://www.w3.org/2001/XMLSchema-instance"
	xmlns="http://digitalhps.org/lerna-query-model" xsi:schemaLocation="http://digitalhps.org/lerna-query-model query-schema.xsd">
	<databaseList>
		<database>1</database>
	</databaseList>
	<dataset id="mblcourses" />
	<node return="true">
		<and>
			<property name="type" value="Course" />
			<relationship return="true" type="attended">
			<property name="year" start="1900"/>
				<source>
					<node return="true">
						<and>
							<property name="type" value="Person" />
							<relationship return="true" type="hasAffiliation">
								<target>
									<node return="true">
										<property name="type" value="Institution" />
										<property name="name" value="Harvard" />
									</node>
								</target>
							</relationship>
						</and>
					</node>
				</source>
			</relationship>
		</and>
	</node>
</query>