<!--Where was Person [P] located?-->
<query 	xmlns:xsi="http://www.w3.org/2001/XMLSchema-instance" 
		xmlns="http://digitalhps.org/lerna-query-model" 
		xsi:schemaLocation="http://digitalhps.org/lerna-query-model query-schema.xsd">
    <databaseList>
		<database>1</database>
	</databaseList>
    <dataset id = "mblcourses" />
    <node return="true">
        <and>
            <property name="type" value="Location" />   
            <relationship return="true" type="hasLocation">
				<source>
					<node>
                        <property name="type" value="Person" />
                        <property name="lastname" value="Setchell" />
                    </node>
                </source>
            </relationship>
        </and>
    </node>      
</query>